{
  "schemaVersion": 1,
  "pack": {
    "id": "dtf-games-promo-30-v1",
    "title": "Срач дня: игры",
    "subtitle": "Угадайте игру по комментариям, которые никто не писал, но все уже читали",
    "locale": "ru-RU",
    "targetAudience": "DTF",
    "answerMode": "game",
    "itemCount": 30,
    "maxAttempts": 10,
    "selectionPolicy": "daily_without_replacement",
    "recommendedOrder": [
      "dtf-atomic-heart",
      "dtf-cyberpunk-2077",
      "dtf-starfield",
      "dtf-the-last-of-us-part-ii",
      "dtf-baldurs-gate-3",
      "dtf-death-stranding",
      "dtf-bloodborne",
      "dtf-the-witcher-3",
      "dtf-stalker-2",
      "dtf-heroes-of-might-and-magic-iii",
      "dtf-elden-ring",
      "dtf-red-dead-redemption-2",
      "dtf-skyrim",
      "dtf-hogwarts-legacy",
      "dtf-helldivers-2",
      "dtf-disco-elysium",
      "dtf-grand-theft-auto-v",
      "dtf-no-mans-sky",
      "dtf-fallout-76",
      "dtf-gothic-ii",
      "dtf-silent-hill-2-remake",
      "dtf-kingdom-come-deliverance-ii",
      "dtf-clair-obscur-expedition-33",
      "dtf-escape-from-tarkov",
      "dtf-mass-effect-3",
      "dtf-dragon-age-the-veilguard",
      "dtf-the-day-before",
      "dtf-assassins-creed-shadows",
      "dtf-pathologic-2",
      "dtf-concord"
    ],
    "comparisonEngine": "existing_compareGames",
    "integrationStrategy": "game_mode_variant",
    "variantKey": "dtf-games-promo-30-v1",
    "cluePolicy": {
      "openingHints": 2,
      "unlockAfterAttempts": [
        5,
        8,
        9
      ],
      "transportField": "progressiveHints",
      "showAuthorArchetypeForOpeningHints": true
    },
    "uiCopy": {
      "modeTitle": "Срач дня",
      "prompt": "О какой игре спорят?",
      "disclaimer": "Все комментарии вымышлены. Совпадения с реальными слишком вероятны.",
      "nextButton": "Следующий срач",
      "challengeButton": "Бросить вызов другу",
      "reportButton": "Написать, что подсказки неправильные"
    },
    "contentPrinciples": [
      "Сатирические реплики основаны на публично обсуждавшихся свойствах игр и инфоповодах.",
      "Дословные комментарии пользователей DTF не используются.",
      "Реальные пользователи и их никнеймы не становятся объектами шутки.",
      "Фактическая спасательная подсказка открывается только после девятой попытки.",
      "Высокоспойлерные карточки можно исключить отдельным фильтром."
    ]
  },
  "compatibility": {
    "currentTitleMode": "game",
    "requiresNewTitleMode": false,
    "reuseExistingCatalogSearch": true,
    "reuseExistingComparison": true,
    "reuseExistingAttemptsLimit": true,
    "reuseExistingChallengeScoring": true,
    "requiredBackendChanges": [
      "Принять variantKey или packId при старте игровой сессии.",
      "Выбрать ответ из списка answerRef выбранного пакета и разрешить его против активной ревизии контента.",
      "Вернуть две стартовые реплики и открывать остальные элементы progressiveHints на 5-й, 8-й и 9-й попытках.",
      "Сохранить packId в challengeKey, чтобы ссылка другу открывала ту же загадку."
    ],
    "recommendedSessionFields": {
      "packId": "dtf-games-promo-30-v1",
      "promoPrompt": "object|null",
      "progressiveHints": "Array<{key,value,unlockAfterAttempts,type}>"
    },
    "fallbackPolicy": "Если ответ не найден в активной ревизии, импортировать fallbackAnswerCard, затем обогатить карточку существующим игровым пайплайном."
  },
  "items": [
    {
      "id": "dtf-cyberpunk-2077",
      "order": 1,
      "answerType": "game",
      "answerRef": {
        "mode": "game",
        "titleRu": "Cyberpunk 2077",
        "titleOriginal": "Cyberpunk 2077",
        "year": 2020,
        "legacyReleaseYears": [],
        "steamAppIds": [
          1091500
        ],
        "aliases": [
          "Киберпанк 2077",
          "Cyberpunk"
        ],
        "resolutionOrder": [
          "steamAppId",
          "normalizedTitleAndYear",
          "normalizedTitle",
          "alias"
        ]
      },
      "catalogAction": "resolve_existing",
      "fallbackAnswerCard": {
        "id": "promo:dtf-cyberpunk-2077",
        "mode": "game",
        "titleRu": "Cyberpunk 2077",
        "titleOriginal": "Cyberpunk 2077",
        "alternativeTitles": [
          "Киберпанк 2077",
          "Cyberpunk"
        ],
        "year": 2020,
        "developers": [
          "CD Projekt Red"
        ],
        "publishers": [
          "CD Projekt"
        ],
        "platforms": [
          "Windows",
          "PlayStation 4",
          "PlayStation 5",
          "Xbox One",
          "Xbox Series X/S"
        ],
        "genres": [
          "Action/RPG",
          "открытый мир",
          "киберпанк"
        ],
        "popularityScore": 99,
        "posterUrl": null,
        "plotHint": null,
        "allowedInGame": true,
        "dataQuality": {
          "source": [
            "dtf_promo_manual"
          ],
          "verified": false,
          "missingFields": [
            "posterUrl",
            "ratings",
            "votes",
            "price",
            "steamCategories",
            "steamTags"
          ]
        },
        "steamAppId": 1091500
      },
      "franchise": "Cyberpunk",
      "difficulty": "easy",
      "recognizability": 0.99,
      "motifs": [
        "сломанный релиз",
        "старые консоли",
        "патчи и искупление",
        "возвращение после аниме",
        "Киану Ривз"
      ],
      "progressiveHints": [
        {
          "key": "opening_1",
          "unlockAfterAttempts": 0,
          "type": "archetype_comment",
          "authorArchetype": "инсайдер",
          "text": "Игра ещё не вышла, а пользователи базовых консолей уже виноваты в том, что она на них не работает.",
          "strength": 0.18,
          "spoilerRisk": "low",
          "sourceKeys": [
            "dtf-corpus",
            "fact-check"
          ]
        },
        {
          "key": "opening_2",
          "unlockAfterAttempts": 0,
          "type": "archetype_comment",
          "authorArchetype": "ветеран предзаказов",
          "text": "После релиза самыми востребованными киберимплантами стали патч, возврат денег и короткая память.",
          "strength": 0.28,
          "spoilerRisk": "low",
          "sourceKeys": [
            "dtf-corpus",
            "fact-check"
          ]
        },
        {
          "key": "after_5",
          "unlockAfterAttempts": 5,
          "type": "satirical_context",
          "text": "Её убрали из крупного консольного магазина, а спустя пару лет аудитория объявила, что теперь-то перед нами именно та игра, которую всем обещали.",
          "strength": 0.55,
          "spoilerRisk": "low",
          "sourceKeys": [
            "dtf-corpus",
            "fact-check"
          ]
        },
        {
          "key": "after_8",
          "unlockAfterAttempts": 8,
          "type": "community_meme",
          "text": "В каждой ветке появляется человек, который начал после патча 2.0 и искренне не понимает, почему остальные до сих пор вспоминают запуск.",
          "strength": 0.78,
          "spoilerRisk": "medium",
          "sourceKeys": [
            "dtf-corpus",
            "fact-check"
          ]
        },
        {
          "key": "after_9",
          "unlockAfterAttempts": 9,
          "type": "factual_rescue",
          "text": "Польская Action/RPG 2020 года про наёмника Ви, Найт-Сити и цифрового Киану Ривза.",
          "strength": 0.96,
          "spoilerRisk": "high",
          "sourceKeys": [
            "dtf-corpus",
            "fact-check"
          ]
        }
      ],
      "result": {
        "tagline": "Верно. Теперь осталось решить, с какого патча ваше мнение считается легитимным.",
        "whyItWasDiscussed": [
          "релиз на PS4 и Xbox One",
          "удаление из PlayStation Store",
          "поздняя реабилитация патчами и Phantom Liberty"
        ],
        "feedbackActionLabel": "Написать, что подсказки неправильные"
      },
      "spoilerProfile": {
        "level": "low",
        "note": "Сюжетные спойлеры несущественны; поздняя подсказка раскрывает только завязку."
      },
      "sources": [
        {
          "key": "dtf-corpus",
          "kind": "discovery_query",
          "url": "https://www.google.com/search?q=site%3Adtf.ru+%22Cyberpunk+2077%22",
          "purpose": "Поиск постов и веток DTF для ручной проверки локального дискурса."
        },
        {
          "key": "fact-check",
          "kind": "reference",
          "url": "https://en.wikipedia.org/wiki/Cyberpunk_2077",
          "purpose": "Базовая проверка года, студии, платформ и событий вокруг релиза."
        },
        {
          "key": "store",
          "kind": "store_metadata",
          "url": "https://store.steampowered.com/app/1091500/",
          "purpose": "Проверка карточки магазина и пользовательского контекста."
        }
      ],
      "moderation": {
        "allCommentTextAuthoredForGame": true,
        "directQuotesUsed": false,
        "realUsersReferenced": false,
        "communityConsensusClaimed": false,
        "manualReviewRequired": true,
        "lastManualReview": null
      }
    },
    {
      "id": "dtf-starfield",
      "order": 2,
      "answerType": "game",
      "answerRef": {
        "mode": "game",
        "titleRu": "Starfield",
        "titleOriginal": "Starfield",
        "year": 2023,
        "legacyReleaseYears": [],
        "steamAppIds": [
          1716740
        ],
        "aliases": [
          "Старфилд"
        ],
        "resolutionOrder": [
          "steamAppId",
          "normalizedTitleAndYear",
          "normalizedTitle",
          "alias"
        ]
      },
      "catalogAction": "resolve_existing",
      "fallbackAnswerCard": {
        "id": "promo:dtf-starfield",
        "mode": "game",
        "titleRu": "Starfield",
        "titleOriginal": "Starfield",
        "alternativeTitles": [
          "Старфилд"
        ],
        "year": 2023,
        "developers": [